{
  "account_id": "ironcladroofing",
  "company_name": "Ironclad Roofing and Restoration LLC",
  "business_hours": {
    "days": null,
    "start": null,
    "end": null,
    "timezone": null
  },
  "office_address": "4210 Ashland City Highway, Nashville, Tennessee, 37218",
  "services_supported": [
    "residential roofing",
    "commercial roofing",
    "insurance restoration",
    "roof repairs",
    "new roofs",
    "re-roofing",
    "flat roofs (TPO, EPDM, modified bitumen)",
    "gutters",
    "siding",
    "storm damage inspections",
    "skylights"
  ],
  "emergency_definition": [],
  "emergency_routing_rules": {
    "primary_contact": null,
    "primary_phone": null,
    "routing_order": [],
    "fallback_action": null
  },
  "non_emergency_routing_rules": {
    "action": null,
    "details": null
  },
  "call_transfer_rules": {
    "timeout_seconds": null,
    "retries": null,
    "message_on_fail": null
  },
  "integration_constraints": [],
  "after_hours_flow_summary": "Clara answers all after-hours calls, captures lead information, and routes it to the sales team for follow-up the next morning.",
  "office_hours_flow_summary": "Shawna handles calls, but also manages invoicing, insurance paperwork, material orders, and CRM entries.",
  "questions_or_unknowns": [
    "What are the exact business hours for Ironclad Roofing?",
    "What is the specific emergency definition and routing rules for after-hours emergencies?",
    "What are the specific non-emergency routing rules and actions?"
  ],
  "notes": "Ryan is highly motivated to implement Clara due to significant missed revenue during storm events. The company experiences high call volumes during storm events, which are critical for their business.",
  "source": "demo_call",
  "version": "v1",
  "created_at": "2023-10-04T14:30:00Z"
}