{
  "account_id": "summitfire",
  "company_name": "Summit Fire Protection LLC",
  "business_hours": {
    "days": null,
    "start": null,
    "end": null,
    "timezone": null
  },
  "office_address": "2740 South Raritan Street, Englewood, Colorado, 80110",
  "services_supported": [
    "fire sprinkler inspections",
    "repair and service work",
    "new construction",
    "fire alarm system testing",
    "fire extinguisher servicing",
    "kitchen hood suppression system inspections"
  ],
  "emergency_definition": [
    "a sprinkler main break",
    "a fire alarm that won't stop going off",
    "water flowing where it shouldn't be",
    "fire watch situations",
    "sprinkler system is down and they need it restored"
  ],
  "emergency_routing_rules": {
    "primary_contact": null,
    "primary_phone": null,
    "routing_order": [
      "on-call technician"
    ],
    "fallback_action": null
  },
  "non_emergency_routing_rules": {
    "action": "Clara takes the message and assures the caller that someone will follow up first thing in the morning.",
    "details": null
  },
  "call_transfer_rules": {
    "timeout_seconds": null,
    "retries": null,
    "message_on_fail": null
  },
  "integration_constraints": [],
  "after_hours_flow_summary": "Clara answers, identifies that it's after-hours, and asks about the situation. If it's a true emergency, Clara immediately tries to connect the caller with the on-call technician. If it's not a true emergency, Clara takes the message and assures the caller that someone will follow up first thing in the morning.",
  "office_hours_flow_summary": null,
  "questions_or_unknowns": [
    "What are the exact business hours for Summit Fire Protection?",
    "What is the exact emergency routing order and fallback actions?",
    "What are the specific call transfer rules and messages?"
  ],
  "notes": "The caller expressed significant interest in the Clara Answers system and its ability to handle calls in both English and Spanish. They also highlighted the importance of handling calls during peak seasons and the need to distinguish between emergency and non-emergency calls.",
  "source": "demo_call",
  "version": "v1",
  "created_at": "2023-10-06T14:30:00Z"
}